{
  "schemaVersion": 3,
  "database": "profile-core",
  "table": "user_specialties",
  "mappings": [
    {
      "key": "subcategory:1:1",
      "kind": "subcategory",
      "mainId": 1,
      "childId": 1,
      "column": "womens_clothing_1"
    },
    {
      "key": "subcategory:1:13",
      "kind": "subcategory",
      "mainId": 1,
      "childId": 13,
      "column": "hijab_fashion_13"
    },
    {
      "key": "subcategory:1:2",
      "kind": "subcategory",
      "mainId": 1,
      "childId": 2,
      "column": "mens_clothing_2"
    },
    {
      "key": "subcategory:1:3",
      "kind": "subcategory",
      "mainId": 1,
      "childId": 3,
      "column": "childrens_and_newborn_clothing_3"
    },
    {
      "key": "subcategory:1:5",
      "kind": "subcategory",
      "mainId": 1,
      "childId": 5,
      "column": "shoes_leather_and_fabric_bags_5"
    },
    {
      "key": "subcategory:1:6",
      "kind": "subcategory",
      "mainId": 1,
      "childId": 6,
      "column": "mens_and_womens_accessories_6"
    },
    {
      "key": "subcategory:1:7",
      "kind": "subcategory",
      "mainId": 1,
      "childId": 7,
      "column": "sportswear_7"
    },
    {
      "key": "subcategory:1:8",
      "kind": "subcategory",
      "mainId": 1,
      "childId": 8,
      "column": "formal_wear_weddings_parties_8"
    },
    {
      "key": "subcategory:1:9",
      "kind": "subcategory",
      "mainId": 1,
      "childId": 9,
      "column": "underwear_and_homewear_9"
    },
    {
      "key": "subcategory:1:11",
      "kind": "subcategory",
      "mainId": 1,
      "childId": 11,
      "column": "stock_lots_11"
    },
    {
      "key": "subcategory:2:1",
      "kind": "subcategory",
      "mainId": 2,
      "childId": 1,
      "column": "quick_dishes_and_fast_meals_1"
    },
    {
      "key": "subcategory:2:2",
      "kind": "subcategory",
      "mainId": 2,
      "childId": 2,
      "column": "bakery_and_pastry_2"
    },
    {
      "key": "subcategory:2:3",
      "kind": "subcategory",
      "mainId": 2,
      "childId": 3,
      "column": "sweets_3"
    },
    {
      "key": "subcategory:2:4",
      "kind": "subcategory",
      "mainId": 2,
      "childId": 4,
      "column": "drinks_and_natural_juices_4"
    },
    {
      "key": "subcategory:2:13",
      "kind": "subcategory",
      "mainId": 2,
      "childId": 13,
      "column": "cafes_13"
    },
    {
      "key": "subcategory:2:14",
      "kind": "subcategory",
      "mainId": 2,
      "childId": 14,
      "column": "restaurants_14"
    },
    {
      "key": "subcategory:2:6",
      "kind": "subcategory",
      "mainId": 2,
      "childId": 6,
      "column": "dairy_and_eggs_6"
    },
    {
      "key": "subcategory:2:7",
      "kind": "subcategory",
      "mainId": 2,
      "childId": 7,
      "column": "spices_and_herbs_7"
    },
    {
      "key": "subcategory:2:8",
      "kind": "subcategory",
      "mainId": 2,
      "childId": 8,
      "column": "nuts_seeds_and_dried_fruits_8"
    },
    {
      "key": "subcategory:2:10",
      "kind": "subcategory",
      "mainId": 2,
      "childId": 10,
      "column": "meat_poultry_and_fish_10"
    },
    {
      "key": "subcategory:3:1",
      "kind": "subcategory",
      "mainId": 3,
      "childId": 1,
      "column": "smartphones_and_tablets_1"
    },
    {
      "key": "subcategory:3:2",
      "kind": "subcategory",
      "mainId": 3,
      "childId": 2,
      "column": "laptops_and_desktops_2"
    },
    {
      "key": "subcategory:3:3",
      "kind": "subcategory",
      "mainId": 3,
      "childId": 3,
      "column": "digital_accessories_3"
    },
    {
      "key": "subcategory:3:4",
      "kind": "subcategory",
      "mainId": 3,
      "childId": 4,
      "column": "development_and_software_4"
    },
    {
      "key": "subcategory:3:7",
      "kind": "subcategory",
      "mainId": 3,
      "childId": 7,
      "column": "cameras_security_and_home_monitoring_7"
    },
    {
      "key": "subcategory:3:11",
      "kind": "subcategory",
      "mainId": 3,
      "childId": 11,
      "column": "networking_and_telecom_11"
    },
    {
      "key": "subcategory:4:1",
      "kind": "subcategory",
      "mainId": 4,
      "childId": 1,
      "column": "skin_and_face_care_1"
    },
    {
      "key": "subcategory:4:2",
      "kind": "subcategory",
      "mainId": 4,
      "childId": 2,
      "column": "hair_care_2"
    },
    {
      "key": "subcategory:4:3",
      "kind": "subcategory",
      "mainId": 4,
      "childId": 3,
      "column": "makeup_and_beauty_tools_3"
    },
    {
      "key": "subcategory:4:4",
      "kind": "subcategory",
      "mainId": 4,
      "childId": 4,
      "column": "perfumes_incense_and_burners_4"
    },
    {
      "key": "subcategory:4:5",
      "kind": "subcategory",
      "mainId": 4,
      "childId": 5,
      "column": "hygiene_and_bath_supplies_5"
    },
    {
      "key": "subcategory:4:11",
      "kind": "subcategory",
      "mainId": 4,
      "childId": 11,
      "column": "electric_personal_care_tools_11"
    },
    {
      "key": "subcategory:4:12",
      "kind": "subcategory",
      "mainId": 4,
      "childId": 12,
      "column": "beauty_centers_12"
    },
    {
      "key": "subcategory:44:1",
      "kind": "subcategory",
      "mainId": 44,
      "childId": 1,
      "column": "mens_and_womens_perfumes_1"
    },
    {
      "key": "subcategory:44:2",
      "kind": "subcategory",
      "mainId": 44,
      "childId": 2,
      "column": "cosmetics_2"
    },
    {
      "key": "subcategory:7:1",
      "kind": "subcategory",
      "mainId": 7,
      "childId": 1,
      "column": "cars_for_sale_1"
    },
    {
      "key": "subcategory:7:5",
      "kind": "subcategory",
      "mainId": 7,
      "childId": 5,
      "column": "vehicle_maintenance_5"
    },
    {
      "key": "subcategory:7:6",
      "kind": "subcategory",
      "mainId": 7,
      "childId": 6,
      "column": "car_rental_services_6"
    },
    {
      "key": "subcategory:7:2",
      "kind": "subcategory",
      "mainId": 7,
      "childId": 2,
      "column": "bicycle_services_2"
    },
    {
      "key": "subcategory:7:3",
      "kind": "subcategory",
      "mainId": 7,
      "childId": 3,
      "column": "spare_parts_3"
    },
    {
      "key": "subcategory:7:4",
      "kind": "subcategory",
      "mainId": 7,
      "childId": 4,
      "column": "vehicle_accessories_4"
    },
    {
      "key": "subcategory:7:7",
      "kind": "subcategory",
      "mainId": 7,
      "childId": 7,
      "column": "oils_tires_wheels_and_batteries_7"
    },
    {
      "key": "subcategory:5:1",
      "kind": "subcategory",
      "mainId": 5,
      "childId": 1,
      "column": "living_room_and_bedroom_furniture_1"
    },
    {
      "key": "subcategory:5:3",
      "kind": "subcategory",
      "mainId": 5,
      "childId": 3,
      "column": "office_furniture_and_workspaces_3"
    },
    {
      "key": "subcategory:5:4",
      "kind": "subcategory",
      "mainId": 5,
      "childId": 4,
      "column": "kitchen_supplies_4"
    },
    {
      "key": "subcategory:5:14",
      "kind": "subcategory",
      "mainId": 5,
      "childId": 14,
      "column": "kitchen_furniture_14"
    },
    {
      "key": "subcategory:5:5",
      "kind": "subcategory",
      "mainId": 5,
      "childId": 5,
      "column": "carpets_curtains_and_rugs_5"
    },
    {
      "key": "subcategory:5:16",
      "kind": "subcategory",
      "mainId": 5,
      "childId": 16,
      "column": "lighting_and_lamps_16"
    },
    {
      "key": "subcategory:5:7",
      "kind": "subcategory",
      "mainId": 5,
      "childId": 7,
      "column": "artworks_and_decor_7"
    },
    {
      "key": "subcategory:5:11",
      "kind": "subcategory",
      "mainId": 5,
      "childId": 11,
      "column": "garden_and_outdoor_decor_11"
    },
    {
      "key": "subcategory:5:12",
      "kind": "subcategory",
      "mainId": 5,
      "childId": 12,
      "column": "bedding_covers_and_pillows_12"
    },
    {
      "key": "subcategory:5:13",
      "kind": "subcategory",
      "mainId": 5,
      "childId": 13,
      "column": "home_electrical_appliances_13"
    },
    {
      "key": "subcategory:5:6",
      "kind": "subcategory",
      "mainId": 5,
      "childId": 6,
      "column": "interior_design_and_decoration_6"
    },
    {
      "key": "subcategory:5:8",
      "kind": "subcategory",
      "mainId": 5,
      "childId": 8,
      "column": "bathroom_and_toilet_supplies_8"
    },
    {
      "key": "subcategory:16:1",
      "kind": "subcategory",
      "mainId": 16,
      "childId": 1,
      "column": "apartments_and_houses_for_sale_or_rent_1"
    },
    {
      "key": "subcategory:16:7",
      "kind": "subcategory",
      "mainId": 16,
      "childId": 7,
      "column": "chalets_and_villas_7"
    },
    {
      "key": "subcategory:16:3",
      "kind": "subcategory",
      "mainId": 16,
      "childId": 3,
      "column": "lands_and_commercial_property_3"
    },
    {
      "key": "subcategory:16:4",
      "kind": "subcategory",
      "mainId": 16,
      "childId": 4,
      "column": "offices_and_workspaces_4"
    },
    {
      "key": "subcategory:45:1",
      "kind": "subcategory",
      "mainId": 45,
      "childId": 1,
      "column": "mens_and_womens_perfumes_1"
    },
    {
      "key": "subcategory:45:2",
      "kind": "subcategory",
      "mainId": 45,
      "childId": 2,
      "column": "cosmetics_2"
    },
    {
      "key": "subcategory:8:2",
      "kind": "subcategory",
      "mainId": 8,
      "childId": 2,
      "column": "gym_2"
    },
    {
      "key": "subcategory:8:4",
      "kind": "subcategory",
      "mainId": 8,
      "childId": 4,
      "column": "sports_equipment_4"
    },
    {
      "key": "subcategory:13:1",
      "kind": "subcategory",
      "mainId": 13,
      "childId": 1,
      "column": "drawing_and_artworks_1"
    },
    {
      "key": "subcategory:13:2",
      "kind": "subcategory",
      "mainId": 13,
      "childId": 2,